{
  "$schema": "../schema/mod.schema.json",
  "id": "simple-slot-block",
  "name": "Simple Slot Block",
  "summary": "Server-side GameGUI script that lets missions open, block or kick player slots using user flags.",
  "description": "Server hook (SimpleSlotBlockGameGUI.lua) installed on the server, not in the mission. Missions enable it by setting flag `SSB` to 100 and control each slot through a flag named after the group.",
  "category": "script",
  "tags": [
    "server",
    "slots",
    "multiplayer",
    "hooks"
  ],
  "authors": [
    {
      "name": "Ciribob",
      "url": "https://github.com/ciribob"
    }
  ],
  "homepage": "https://github.com/ciribob/DCS-SimpleSlotBlock",
  "source": "https://github.com/ciribob/DCS-SimpleSlotBlock",
  "installable": false,
  "releases": [
    {
      "version": "1.3",
      "date": "2022-03-20",
      "changelog": "Version string from ssb.version in the script; date is last commit.",
      "download": {
        "kind": "page",
        "url": "https://github.com/ciribob/DCS-SimpleSlotBlock"
      }
    }
  ]
}
