{
  "$schema": "../schema/mod.schema.json",
  "id": "sea-king-ai-mod",
  "name": "SH-3 Sea King AI Mod",
  "summary": "AI-only SH-3G/SH-3H Sea King naval helicopter mod for DCS World.",
  "description": "Adds AI SH-3G and SH-3H Sea King helicopters for missions, with a paint kit. Downloads are on Mega via the ED forum thread.",
  "category": "aircraft",
  "tags": [
    "helicopter",
    "ai",
    "naval",
    "asw"
  ],
  "authors": [
    {
      "name": "Tomcat-Flyer"
    }
  ],
  "homepage": "https://forum.dcs.world/topic/309243-sea-king-ai-mod/",
  "cover": {
    "url": "https://commons.wikimedia.org/wiki/Special:FilePath/SH-3H_Sea_King_HS-2_in_flight_in_1983.JPEG?width=1920",
    "credit": "U.S. Navy",
    "license": "Public domain",
    "source": "https://commons.wikimedia.org/wiki/File:SH-3H_Sea_King_HS-2_in_flight_in_1983.JPEG"
  },
  "images": [
    "https://forum.dcs.world/uploads/monthly_2022_09/image.png.7c1e3b5f6de3cc2b31cd2ae902e5343e.png"
  ],
  "releases": [
    {
      "version": "1.4",
      "download": {
        "kind": "page",
        "url": "https://forum.dcs.world/topic/309243-sea-king-ai-mod/"
      }
    }
  ]
}
