{
  "$schema": "../schema/mod.schema.json",
  "id": "vsn-su-34",
  "name": "VSN Su-34",
  "summary": "VSN team's free flyable Su-34 using the ED model.",
  "description": "Free VSN mod making the Su-34 (ED model) flyable with an FC3 cockpit. Flyable with the FC3 (F-15C/Su-27-style) cockpit, or as AI without FC3.\n\nVSN's downloads are on pCloud and ask for a password; VSN publishes it on their download index: `VSNROX`.\n\nRequires: Flyable only with Flaming Cliffs 3 installed; otherwise usable as AI.",
  "category": "aircraft",
  "tags": [
    "jet",
    "strike",
    "russia",
    "modern",
    "flyable",
    "ai"
  ],
  "authors": [
    {
      "name": "VSN (cdpkobra)",
      "url": "https://www.lockonforum.de/community/thread/6667-flyable-fc3-flieger-mit-3d-f-15c-cockpit/"
    }
  ],
  "license": "Free, private use only, commercial use prohibited (VSN terms)",
  "homepage": "https://filedn.eu/lry92aiYXwlhFlDghoB2OEp/VSN_html_Links/VSN_MODS.html",
  "cover": {
    "url": "https://commons.wikimedia.org/wiki/Special:FilePath/Sukhoi_Su-34_Fullback_03_red_(8726230751).jpg?width=1920",
    "credit": "Alan Wilson",
    "license": "CC BY-SA 2.0",
    "source": "https://commons.wikimedia.org/wiki/File:Sukhoi_Su-34_Fullback_03_red_(8726230751).jpg"
  },
  "requires_modules": [
    "DCS: Flaming Cliffs 3"
  ],
  "releases": [
    {
      "version": "2025-11-25",
      "changelog": "No version shown; date is when VSN refreshed the download links.",
      "download": {
        "kind": "page",
        "url": "https://e.pcloud.link/publink/show?code=kZmmzAZAAcajsR8pSSqYyRNsVBjCjF1T51X"
      }
    }
  ]
}
