{
  "$schema": "../schema/mod.schema.json",
  "id": "gloster-meteor-ai-halfscience",
  "name": "Gloster Meteor AI Asset",
  "summary": "Non-animated AI Gloster Meteor aircraft asset for DCS World missions.",
  "description": "AI-controlled Gloster Meteor asset with an approximate flight model tuned to public performance data (no EFM). Technically player-controllable but has no animations or working cockpit. 3D model by helijah (Sketchfab), used with permission.",
  "category": "aircraft",
  "tags": [
    "jet",
    "ai",
    "fighter",
    "early jet",
    "uk"
  ],
  "authors": [
    {
      "name": "HalfScience"
    }
  ],
  "license": "Freeware - free version, do not redistribute",
  "homepage": "https://files.digitalcombatsimulator.com/en/files/3345616/",
  "cover": {
    "url": "https://commons.wikimedia.org/wiki/Special:FilePath/Gloster_Meteor_2.jpg?width=1920",
    "credit": "Ecclésiaste-1.2",
    "license": "CC BY-SA 4.0",
    "source": "https://commons.wikimedia.org/wiki/File:Gloster_Meteor_2.jpg"
  },
  "images": [
    "https://files.digitalcombatsimulator.com/upload/userfiles/51d/3n7zlpyr77hs0zft6nstcfelqofsmifp/base-menu-window2.png"
  ],
  "releases": [
    {
      "version": "2025-07-07",
      "date": "2025-07-07",
      "download": {
        "kind": "page",
        "url": "https://files.digitalcombatsimulator.com/en/files/3345616/"
      }
    }
  ]
}
