{
  "$schema": "../schema/mod.schema.json",
  "id": "vsn-f-16cm-block-50",
  "name": "VSN F-16CM Block 50 (ED model)",
  "summary": "VSN team's free FC3-style F-16CM Block 50 using the ED F-16C model.",
  "description": "Free VSN mod making an FC3-style flyable F-16CM Block 50 using the ED F-16C model from the DCS install. Flyable with the FC3 (F-15C/Su-27-style) cockpit, or as AI without FC3.\n\nVSN's downloads are on pCloud and ask for a password; VSN publishes it on their download index: `VSNROX`.\n\nRequires: Flyable only with Flaming Cliffs 3 installed; otherwise usable as AI.",
  "category": "aircraft",
  "tags": [
    "jet",
    "fighter",
    "multirole",
    "flyable",
    "ai"
  ],
  "authors": [
    {
      "name": "VSN (cdpkobra)",
      "url": "https://www.lockonforum.de/community/thread/6667-flyable-fc3-flieger-mit-3d-f-15c-cockpit/"
    }
  ],
  "license": "Free, private use only, commercial use prohibited (VSN terms)",
  "homepage": "https://filedn.eu/lry92aiYXwlhFlDghoB2OEp/VSN_html_Links/VSN_MODS.html",
  "cover": {
    "url": "https://commons.wikimedia.org/wiki/Special:FilePath/90-813-SP,_2017,_F-16CM_Fighting_Falcon,_Fairford,_USAFE_-_4291_(53949948376).jpg?width=1920",
    "credit": "Jim van de Burgt",
    "license": "CC0",
    "source": "https://commons.wikimedia.org/wiki/File:90-813-SP,_2017,_F-16CM_Fighting_Falcon,_Fairford,_USAFE_-_4291_(53949948376).jpg"
  },
  "requires_modules": [
    "DCS: Flaming Cliffs 3"
  ],
  "releases": [
    {
      "version": "2025-11-25",
      "changelog": "No version shown; date is when VSN refreshed the download links.",
      "download": {
        "kind": "page",
        "url": "https://e.pcloud.link/publink/show?code=kZQYzAZVHP9snynp78Tyn8d0nuSDL0K0Jik"
      }
    }
  ]
}
