{
  "$schema": "../schema/mod.schema.json",
  "id": "english-electric-canberra-ai-halfscience",
  "name": "English Electric Canberra AI Asset",
  "summary": "Non-animated AI English Electric Canberra aircraft asset for DCS World missions.",
  "description": "AI-controlled English Electric Canberra asset with an approximate flight model tuned to public performance data (no EFM). Technically player-controllable but has no animations or working cockpit. 3D model by Captain Ahab 62 (Thingiverse), used with permission.",
  "category": "aircraft",
  "tags": [
    "jet",
    "ai",
    "bomber",
    "cold war",
    "uk"
  ],
  "authors": [
    {
      "name": "HalfScience"
    }
  ],
  "license": "Freeware - free version, do not redistribute",
  "homepage": "https://files.digitalcombatsimulator.com/en/files/3346784/",
  "cover": {
    "url": "https://commons.wikimedia.org/wiki/Special:FilePath/R2504_English_Electric_Canberra_B.2_(8642419527).jpg?width=1920",
    "credit": "Bob Adams",
    "license": "CC BY-SA 2.0",
    "source": "https://commons.wikimedia.org/wiki/File:R2504_English_Electric_Canberra_B.2_(8642419527).jpg"
  },
  "images": [
    "https://files.digitalcombatsimulator.com/upload/userfiles/a43/a2ws36lzy8du988hyyu1y7qczf2zi4y0/canberra_100.png"
  ],
  "releases": [
    {
      "version": "2025-09-04",
      "date": "2025-09-04",
      "download": {
        "kind": "page",
        "url": "https://files.digitalcombatsimulator.com/en/files/3346784/"
      }
    }
  ]
}
