{
  "$schema": "../schema/mod.schema.json",
  "id": "spino-f-15c-golden-eagle",
  "name": "F-15C Golden Eagle Upgrade (Spino)",
  "summary": "Freeware upgraded F-15C variant with AESA radar stand-in and AIM-9X support.",
  "description": "Adds an upgraded F-15C (APG-63v3 stand-in, native AIM-9X). Copy into `Saved Games\\DCS\\Mods\\aircraft`. With the F-15EX mod installed it also gains extra AIM-120 variants, AIM-260A and MAKO.\n\nRequires: F-15EX Eagle II mod (Spino) optional, for extra weapons.",
  "category": "aircraft",
  "tags": [
    "jet",
    "fighter",
    "usaf",
    "f-15"
  ],
  "authors": [
    {
      "name": "Spino7"
    }
  ],
  "license": "Freeware (do not redistribute)",
  "homepage": "https://www.digitalcombatsimulator.com/en/files/3331163/",
  "cover": {
    "url": "https://commons.wikimedia.org/wiki/Special:FilePath/An_F-15C_Eagle_from_the_173rd_Fighter_Wing_taxis_before_taking_off_for_a_large_force_exercise_as_part_of_the_19th_Air_Force_Commander%E2%80%99s_Call_and_Fly-In_at_Holloman_Air_Force_Base,_New_Mexico,_March_3,_2023.jpg?width=1920",
    "credit": "U.S. Air National Guard photo by Tech. Sgt. Victor J. Caputo",
    "license": "Public domain",
    "source": "https://commons.wikimedia.org/wiki/File:An_F-15C_Eagle_from_the_173rd_Fighter_Wing_taxis_before_taking_off_for_a_large_force_exercise_as_part_of_the_19th_Air_Force_Commander%E2%80%99s_Call_and_Fly-In_at_Holloman_Air_Force_Base,_New_Mexico,_March_3,_2023.jpg"
  },
  "images": [
    "https://files.digitalcombatsimulator.com/upload/userfiles/8e3/oymspw57z0zl1x4k526p9td5k2t5ka6u/F-15C_GE.jpg"
  ],
  "releases": [
    {
      "version": "1.5",
      "date": "2023-06-07",
      "download": {
        "kind": "page",
        "url": "https://www.digitalcombatsimulator.com/en/files/3331163/"
      }
    }
  ]
}
